{
  "action_id": "action-1",
  "asset_path": "assets/cards/incident.json",
  "card_instance_id": "card-1",
  "card_source": "asset",
  "catalog_item": "incident_summary",
  "catalog_name": "default",
  "envelope": {},
  "inline_json": {
    "actions": [],
    "body": [],
    "type": "AdaptiveCard",
    "version": "1.3"
  },
  "interaction_type": "Submit",
  "mode": "renderAndValidate",
  "needs_interaction": false,
  "node_id": "",
  "payload": {},
  "raw_inputs": {},
  "session": {},
  "state": {},
  "template_params": {}
}
